sakid,tittel,emneord,sammendrag
IA-arbeidet og Jobbstrategien er alle eksempler på arbeid for å
få flere som kan og vil, inn i arbeidslivet. Flertallet vektlegger
at dette arbeidet skal fortsette, slik at arbeidslinjen blir mer
inkluderende og flere kommer i arbeid og aktivitet.
Flertallet vektlegger at forvaltningen
og ordningene skal bidra til å nå målet om flere i arbeid.
Flertallet understreker at det
ikke er tilfeldig at tilstandsrapporten i meldingen viser at vi
overordnet har et svært godt arbeidsliv i Norge, ei heller at det
skal forbli slik i framtiden. Hva slags arbeidsliv vi skal ha, er
etter flertallets mening et resultat av politiske
valg. Flertallet viser til at regjeringen vil sikre
og styrke arbeidstakernes rettigheter og føre en ambisiøs politikk
for et godt arbeidsmiljø både i privat og offentlig sektor.
1.3.2	Generelle merknader fra 
Fremskrittspartiet, Høyre og Kristelig 
Folkeparti
Komiteens medlemmer fra Fremskrittspartiet,
Høyre og Kristelig Folkeparti mener meldingen viser at svært
mye er bra i norsk arbeidsliv. Dette er også i tråd med andre undersøkelser,
som for eksempel YS’ arbeidslivsbarometer. Samtidig har norsk arbeidsliv noen
utford-ringer. Mange arbeidstakere savner noe større fleksibilitet
som gjør det lettere å finne balansen mellom arbeid og privatliv. Disse medlemmer mener
derfor vi bør ha et livsfasetilpasset arbeidsliv slik at familieliv
og omsorg for barn, syke eller eldre familiemedlemmer kan kombineres
med arbeid. Disse medlemmer vil også understreke
viktigheten av at man har en lav terskel inn i arbeidslivet for
grupper som tradisjonelt har hatt vanskeligheter med å komme seg
inn i arbeidsmarkedet, som for eksempel personer med nedsatt funksjonsevne,
utviklingshemmede, innvandrere og unge med lav utdannelse. Den økonomiske
krisen gjør at kravene til konkurransekraft og omstilling blir større.
Med eldrebølgen får vi betydelige bemanningsutfordringer særlig
innenfor pleie- og omsorgssektoren.
Disse medlemmer vil understreke
viktigheten av et godt og velfungerende trepartssamarbeid. At norsk
arbeidsliv er preget av et godt og konstruktivt forhold mellom myndighetene og
ansvarlige organisasjoner på både arbeidstaker- og arbeidsgiversiden,
er et viktig konkurranseforttrinn internasjonalt. Disse medlemmer peker
på at et godt og velfungerende trepartssamarbeid forutsetter at
alle berørte parter, både på arbeidstakersiden og arbeidsgiversiden,
blir hørt. Disse medlemmer vil uttrykke bekymring
over de signaler som er kommet fra arbeidsgiversiden og deler av
arbeidstakersiden om at dette ikke alltid er tilfellet.
Disse medlemmer viser til at
man i enkelte deler av norsk arbeidsliv, som i deler av renholdsbransjen
og bygg- og anleggsbransjen, har sett eksempler på sosial dumping. Disse
medlemmer viser til at Fremskrittspartiet, Høyre og Kristelig
Folkeparti har støttet eller delvis støttet det store flertallet
av forslagene regjeringen har fremmet mot sosial dumping, og at
de har fremmet forslag om alternativer til de tiltakene de ikke
har støttet.
Disse medlemmer mener den norske
modellen hviler på vår felles arbeidsinnsats. For å sikre velferden
også i fremtiden er vi ikke bare avhengige av å opprettholde en
høy sysselsetting, men å mobilisere mer arbeidskraft. Arbeidslivspolitikken
må derfor innrettes slik at lovverket er oversiktlig og så enkelt
som mulig å følge, samtidig som det sikrer at arbeidstakerne beskyttes mot
uforholdsmessig høy arbeidstid, usikkerhet og, i verste fall, rent
misbruk. Disse medlemmer ønsker derfor å bevare arbeidsmiljøloven samtidig
som det foreslås forsiktige oppmykninger.
Disse medlemmer mener det er
viktig at norske arbeidstakere kjenner til reglene for organisering
i arbeidslivet, slik at de kan ta en informert beslutning om hvorvidt
de ønsker å organisere seg eller ikke.
Disse medlemmer mener arbeidstidsrammene
for individuelle avtaler og avtaler med lokale tillitsvalgte bør
justeres noe opp, men slik at det fortsatt er et skille mellom disse
to. Disse medlemmer ønsker også et mer fleksibelt
regelverk for gjennomsnittsberegning.
Disse medlemmer ser svært positivt
på forsøk med såkalt alternativ turnus eller ønsketurnus som har
hatt gode resultater både for brukere og ansatte flere steder i
landet. Forsøk med alternativ turnus har gitt brukerne en mer forutsigbar
hverdag, samtidig som de ansatte har fått lengre friperioder. Mye
kan også tyde på at slike turnusordninger bidrar til bedre ressursutnyttelse,
lavere sykefravær og færre deltidsstillinger. Disse medlemmer ønsker
å gjeninnføre Arbeidstilsynets generelle adgang til å dispensere
fra lovens krav om daglig og ukentlig arbeidstid dersom det er lokal
enighet mellom arbeidstaker og arbeidsgiver. Arbeidstilsynets adgang
til å dispensere fra lovens krav vil da være på linje med den muligheten fagforeninger
med innstillingsrett har. Ved å åpne en ny vei til alternativ turnus
ved siden av dagens praksis vil alternativ turnus kunne brukes i større
utstrekning enn i dag. Disse medlemmer mener det
er svært viktig at alternativ turnus planlegges sammen med de ansatte. Disse medlemmer ønsker
at godkjenningsperioden for alternativ turnus skal være på inntil
fire år.
Disse medlemmer viser til at
overtidsarbeidet i dag ikke må overstige ti timer i løpet av sju
dager, 25 timer i fire sammenhengende uker og 200 timer innenfor
en periode på 52 uker. Dette kan utvides ved samarbeid med lokale tillitsvalgte
til 300 timer per år og noe mer intensitet, og utvides ytterligere
etter søknad til Arbeidstilsynet, som ved særlige tilfeller kan
gi adgang til 200 timer i løpet av et halvt år. Disse medlemmer mener
det er viktig å forene hensynet til fleksibiliteten som kan være
avgjørende i både det private og det offentlige, med klare og tydelige
regler som sikrer arbeidstakerne. Disse medlemmer vil
også påpeke at både arbeidsmiljøloven og avtalene i arbeidslivet
sikrer arbeidstakerne lønnskompensasjon ved overtid. Disse
medlemmer mener det er viktig å ha grenser for hvor mye
overtidsarbeid som kan pålegges arbeidstakerne. Regler for uttak
av overtid bør gjøres noe mer flek-sible.
Disse medlemmer mener faste ansettelser
er og fortsatt skal være hovedregelen i norsk arbeidsliv. I dag
er det en forskjell mellom tjenestemannsloven og arbeidsmiljøloven
hva gjelder anledningen til midlertidig ansettelse av personer som
«bare trengs for et begrenset tidsrom eller for å utføre et bestemt
oppdrag». Disse medlemmer ser ingen grunn til at
staten skal ha større fleksibilitet enn andre virksomheter i så måte,
og ønsker derfor å åpne for midlertidige ansettelser i det private
i samme grad som det tjenestemannsloven åpner for i det offentlige. Samtidig
vil disse medlemmer understreke at faste behov skal
dekkes gjennom faste ansettelser i alle deler av arbeidslivet, og
at Arbeidstilsynet bør påse at disse reglene følges. Disse medlemmer mener
det er viktig at terskelen inn i arbeidslivet er lav, ikke minst
for grupper som kan ha problemer med å komme inn i arbeidslivet. Disse
medlemmer understreker at enhver åpning for økt bruk av
midlertidig ansettelse må kombineres med et sterkt og klart vern som
sikrer at arbeidstakere ikke blir gående som midlertidig ansatte
på ubestemt tid. Dette bør sikres ved at loven har tydelige rammer
for når en ansatt har rett til fast stilling, og ved at loven presiserer
at midlertidig ansettelse som hovedregel skal brukes for å fylle
midlertidige behov.
Disse medlemmer konstaterer at
en stor andel arbeidstakere i såkalt særlig uavhengig stilling,
er unntatt arbeidstidsbestemmelsene i arbeidsmiljøloven. Regjeringen
Bondevik II endret dette slik at også disse arbeidstakerne i utgangspunktet
ble inkludert i lovens bestemmelser, men denne endringen ble senere reversert
av regjeringen Stoltenberg II.
1.3.3	Generelle merknader fra 
Fremskrittspartiet
Komiteens medlemmer fra Fremskrittspartiet viser
til at regjeringen bekrefter i meldingen at arbeidsforholdene i
Norge er svært gode. Ni av ti arbeidstakere er fornøyde med jobben
sin. Arbeidsforholdene er stort sett bedre enn i andre land, og
de senere årene har også svært mange opplevd en ytterligere forbedring
av arbeidsmiljø og arbeidsvilkår. Disse medlemmer er
tilfreds med at meldingen dokumenterer at arbeidsforholdene for
det store flertall av ansatte i Norge er gode.
Disse medlemmer vil påpeke at
meldingen ikke, på en tilfredsstillende måte, berører sentrale utviklingstrekk
som for eksempel:
Overgangen fra et
industrisamfunn til et tjenestesamfunn og konsekvensene av dette.
Yngre arbeidstakeres forventning til karriere
og et fleksibelt arbeidsliv er ikke drøftet.
Utviklingen i retning av langt flere seniorer/eldre
i deler av arbeidslivet vil utfordre organisering og regulering
av arbeidslivet.
Et globalt utdannings- og arbeidsmarked
for stadig flere gir et mangfold av muligheter og utford-ringer
ut over problemstillinger som sosial dumping.
Disse medlemmer vil videre vise
til at Norge trenger mer arbeidskraft i tiden fremover. I nasjonalbudsjettet
for 2012 understreker regjeringen at aldringen av befolkningen innebærer
at arbeidsinnsatsen per innbygger må øke betydelig fremover, dersom
vi skal opprettholde dagens velferdssamfunn.
Disse medlemmer viser til tall
fra Spekter og EUROSTAT hvor det fremgår at at norske menn jobber
i snitt 37,2 timer i uka, mens norske kvinner jobber 30,5 timer
i uka. Til sammen jobber nordmenn i snitt 33,8 timer i uka. Det
inkluderer overtid. Sammenliknet med Sverige, Danmark, Tyskland,
Frankrike og Storbritannia jobber nordmenn nest minst. Danskene
jobber litt mindre enn oss, med sine 33,5 timer. Franskmennene jobber
mest med 38 timer i uka. Tyskerne jobber 35,7 timer i uka, mens
britene jobber 36,4 timer i uka. Svenskene jobber 4,4 timer mer
enn oss i uka og 210 timer mer enn oss i året. Hadde en lagt svenskenes
arbeidsinnsats til grunn, ville nasjonen Norge fått en ekstrainntekt
på flere tusen milliarder.
Disse medlemmer mener dette underbygger det
faktum at Norge har et enormt behov for å utløse mer arbeidskraft
i fremtiden, og måten man kan få det til på, er blant annet ved
å redusere sykefraværet, få flere funksjonshemmede i arbeid og ved
å få flere av dem som jobber deltid til å jobbe heltid.
Disse medlemmer vil også peke
på at nye arbeidsoppgaver, endringer i familieliv, teknologiske
hjelpemidler og en stadig utvikling av nye tjenester bidrar til
at mange ser annerledes på arbeidslivets krav og forventninger.
Mange av reguleringene i norsk arbeidsliv er basert på industrisamfunnets
organisering, mens det faktiske arbeidsliv er i større og større
grad gått i retning av å være basert på tjenesteyting i privat og offentlig
sektor.
Disse medlemmer konstaterer at
det norske arbeidslivet er i stadig forandring, men arbeidstidsbestemmelsene
er de samme.
Disse medlemmer mener det er
arbeid som bærer velferdssamfunnet og at det er nasjonens evne til
å mobilisere arbeidskraft som vil være suksesskriterium nummer én.
Derfor mener disse medlemmer at
tiden er inne for at man nedsetter en arbeidstidskommisjon som får
i oppgave å se på praktiseringen av arbeidstidsbestemmelsene. En
slik helhetlig og faglig gjennomgang har ikke vært gjennomført tidligere.
Disse medlemmer mener videre
at målet med en slik kommisjon må være å finne løsninger som kan
utløse arbeidskraft
på kort og lang sikt
øke andelen heltidsstillinger
sikre at virksomhetenes behov for drift
ivaretas, samtidig som arbeidstiden bedre kan tilpasses den enkelte
arbeidstaker
Disse medlemmer er videre opptatt
av å skape et trygt og fleksibelt arbeidsliv med plass til alle.
Fortsatt er det alt or mange personer mellom 16–67 år som ufrivillig
faller utenfor arbeidslivet. I statsbudsjettet for 2012 er tallet
anslått til ca. 600 000 personer. Å overføre unge mennesker til
en permanent, inaktiv tilværelse med passive ytelser fra folketrygden
som livsgrunnlag, er en fallitterklæring. For alle dem som har en
mulighet til å utnytte eller opparbeide en arbeidsevne – stor eller
liten – må det utvik-les bedre prosesser for oppfølging, kvalifisering
og trening som kan bidra til å styrke deres muligheter til deltakelse
i det ordinære arbeidslivet.
Disse medlemmer viser i den forbindelse
til sine merknader og forslag i forbindelse med behandlingen av
statsbudsjettet for 2012, jf. Innst. 15 S (2011–2012), hvor Fremskrittspartiet
fremmet forslag om en egen jobbstrategi med fokus på å skape et
arbeidsliv for de med nedsatt arbeidsevne.
1.3.4	Generelle merknader fra Høyre
Komiteens medlemmer fra Høyre viser
til at den norske modellen har mange kjennetegn. Norge er et lite
land med en internasjonalisert økonomi, et stabilt folkestyre og
en rettsstat som sikrer innbyggerne. Det preges av stor sosial tillit og
sterk vilje til å hjelpe de som trenger en håndsrekning. Norge er
et land hvor folk flest har det godt. Disse medlemmer vil
understreke at velferden alle nyter godt av, ikke bare skyldes politiske
vedtak. Velferd må skapes før den kan deles. Norges velferd sikres
først og fremst av alle de som hver dag går på jobb. Arbeid er bærebjelken
til det norske velferdssamfunnet.
Disse medlemmer mener de aller
fleste nordmenn er villige til å betale skatt for å sikre gode, trygge
ordninger for dem som faller utenfor og ikke kan jobbe. Samfunnsmodellen
forutsetter samtidig at de som kan jobbe, jobber, og at de som kan
jobbe litt, jobber litt. Disse medlemmer mener derfor
det er svært viktig at nordmenn flest i det store og hele trives
på jobben. Det bekreftes både av Meld. St. 29 (2010–2011) og av
Yrkesorganisasjonenes Sentralforbunds faste undersøkelser om norsk
arbeidsliv.
Disse medlemmer vil understreke
viktigheten av et godt og velfungerende trepartssamarbeid. At norsk
arbeidsliv er preget av et godt og konstruktivt forhold mellom myndighetene og
ansvarlige organisasjoner på både arbeidstaker- og arbeidsgiversiden
er et viktig konkurranseforttrinn internasjonalt og en bærebjelke
i vårt velferdssamfunn.
Disse medlemmer vil påpeke at
alle organisasjonene i arbeidslivet, både på arbeidstakersiden og
arbeidsgiversiden, må bli hørt. Disse medlemmer ser
derfor med bekymring på de signaler som kommer fra flere arbeidsgiverorganisasjoner
om at regjeringens manglende vilje til å lytte langt ifra styrker
trepartssamarbeidet. Det vises blant annet til svar fra Virke i
komiteens høring om tiltakspakken for Vikarbyrådirektivet 13. april
2012. Disse medlemmer viser også til uttalelser som
lederen i Yrkesorganisasjonenes Sentralforbund kom med i Klassekampen
6. mars, der han gir uttrykk for at man opplever en urimelig forskjell
mellom hvordan regjeringen forholder seg til LO sammenliknet med
hvordan man forholder seg til andre.
Disse medlemmer mener allikevel
at norsk arbeidsliv står overfor noen store utfordringer:
1.	Verdensøkonomien
er i ulage, og selv om Norge foreløpig har klart seg godt, vil utfordringene
dette skaper også påvirke oss. Land som opplever sviktende vekst
vil satse sterkt på å bedre sin konkurransekraft, noe som igjen
vil påvirke oss. Slike endringer kan komme brått. Samtidig vet man
at Norge har et høyt kostnadsnivå og at man er avhengige av å jobbe
smartere og mer effektivt for å sikre arbeidsplassene. Derfor er
det viktig at arbeidslivet har den nødvendige fleksibilitet til
å gjøre raske omstillinger, bedre konkurranseevnen og sikre norske
arbeidsplasser.
2.	Eldrebølgen gir flere eldre og pleietrengende, noe
som igjen vil øke ressursbehovet i offentlig sektor. Både av hensyn
til de eldre og av hensynet til arbeidsplasser i privat sektor krever
dette løftet ikke bare flere ressurser, men større fleksibilitet
både for arbeidstaker og arbeidsgiver når det gjelder å ta i bruk
arbeidskraften – menneskene – best mulig.
3.	Hverdagen for norske familier har endret
seg de siste tiårene. Det skyldes blant annet at langt flere kvinner
er kommet i jobb, at samlivsformene endres og at nye næringer og
nye arbeidsplasser har andre behov enn de tradisjonelle industriarbeidsplassene.
Fleksibilitet er et gode for mange arbeidstakere fordi det gir større
mulighet til å kombinere arbeid og fritid på en god måte, og dermed
kunne ivareta både familieliv og arbeid.
4.	Respekt for loven er grunnleggende,
og omfattende brudd på arbeidsmiljøloven er dokumentert i både offentlige
og private virksomheter. Norsk lov skal selvfølgelig følges, men
samtidig kan det store antallet lovbrudd både i offentlig og privat
sektor indikere at loven ikke er godt nok tilpasset virkelighetens
verden.
5.	Arbeidsinnvandring kan være et gode
og det er avgjørende at arbeidsinnvandrere har de samme rettigheter
og plikter som andre. Samtidig har arbeidsinnvandringen etter 2004
skutt fart, og det meldes i deler av arbeidslivet om uverdige forhold
og useriøse aktører. Disse medlemmer ønsker et fritt
arbeidsmarked, men ikke sosial dumping gjennom uakseptable lønns-
og arbeidsvilkår.
Disse medlemmer mener et godt
utgangspunkt for diskusjonen om et moderne, trygt og fleksibelt
arbeidsliv er statsminister Jens Stoltenbergs innlegg i Dagens Næringsliv
21. mai 2011 hvor han skrev om at arbeidsmiljøloven, sitat:
«[h]eller ikke denne loven er hugget i stein. Vi skal
modernisere loven i takt med utviklingen i arbeidslivet.»
Disse medlemmer merker seg samtidig
at regjeringen Stoltenberg I satte ned Arbeidslivslovutvalget som
skulle gjennomgå og se på modernisering av reglene i arbeidslivet,
og viser til Dagens Næringsliv 5. juni 2001 hvor statsminister Stoltenbergs
daværende arbeidsminister, Jørgen Kosmo, blant annet uttaler følgende,
sitat:
«Våre behov og muligheter når vi er 20 og 65 år, er
ulike. Vi ønsker å se på muligheter for å se arbeidslivsløpet mer
under ett. Vi ønsker større grad av fleksibilitet, både for arbeidstagere
og arbeidsgivere»
og
«Bestemmelsen om maksimalt 300 timer overtid i året
sier også noe om hvor mye man kan ta ut per uke og måned. Det er
et spørsmål om dette er litt for firkantet. Vi må for eksempel se
på om det skal bli anledning til å jobbe mer overtid et år, for
så å jobbe mindre et annet.»
Disse medlemmer er enige i at
dagens lov i noen tilfeller er for lite fleksibel, men vil samtidig
understreke at arbeidsmiljøloven må gi grunnleggende beskyttelse
til alle arbeidstakere, herunder inkludert beskyttelse fra et urimelig stort
arbeidspress. Et slikt arbeidspress vil kunne resultere i en større
avgang til helserelaterte ytelser som sykepenger, arbeidsavklaringspenger
og uføretrygd. Det vil være ødeleggende både for individene som
blir rammet av det og for vår samfunnsmodells økonomiske bærekraft, og
er derfor en situasjon som disse medlemmer vil unngå. Disse
medlemmer konstaterer at de rød-grønne partiene har unntatt
store grupper av arbeidstakere fra vernet i arbeidsmiljøloven og
mener dette er en problemstilling som må vurderes nøye.
Disse medlemmer vil legge vekt
på det følgende i sitt arbeid med arbeidslivspolitikken:
1.	Arbeidsmiljølovens
vern av arbeidstakerne som en grunnplanke i norsk arbeidsliv skal sikres.
Samtidig er det viktig å understreke at dagens lov også gir et betydelig
rom for fleksibilitet dersom ansatte og arbeidsgivere blir enige.
2.	Det er ønskelig med moderate endringer
som gir både arbeidstakere og arbeidsgivere mer fleksibilitet. I
større grad enn i dag bør beslutninger desentraliseres og avgjøres
på den enkelte arbeidsplass.
3.	Det er avgjørende med et sterkt og effektivt
arbeidstilsyn som kan kontrollere at loven etterleves i praksis.
Arbeidstilsynet må styrkes som faglig organ og som kontrollorgan.
4.	Et godt og bredt organisert arbeidsliv
er et gode. Derfor bør arbeidsmiljøloven fortsatt oppmuntre til
et organisert arbeidsliv både på arbeidstaker- og arbeidsgiversiden,
herunder fordelen ved tariffavtaler og god dialog med de ansatte.
Dette innebærer at disse medlemmer blant annet
ønsker klare grenser for hvor mye overtidsarbeid som er tillatt,
sikring av de tillitsvalgtes medvirkning, fortsatt lovfesting av
overtidsbetaling og sterke garantier mot usaklig oppsigelse. Moderate
endringer av arbeidsmiljøloven skal bygge videre på den norske modellen,
ikke bryte med den.
1.3.5	Generelle merknader fra Kristelig 
Folkeparti
Komiteens medlem fra Kristelig
Folkeparti er glad for at det i store hovedtrekk står bra
til med norsk arbeidsliv, og merker seg at det er stor tilslutning
til dette blant høringsinstansene. Dette medlem mener
at det er særdeles viktig å ha et arbeidsliv som er konkurransedyktig
på det internasjonale markedet, og høy kompetanse i arbeidsmarkedet
er avgjørende for å få dette til. Fokus på utdanning og forskning
er viktig for at Norge skal være i verdenstoppen.
Dette medlem vil ha et arbeidsliv
der alle som har mulighet til å arbeide, kan delta, og hvor det føres
en aktiv innsats for å inkludere alle, og for-hindre utstøting.
Myndighetene, arbeidstakerne og arbeidsgiverne må samarbeide aktivt
for å nå dette målet. Det er viktig at myndighetene legger til rette
for at ordningene skal ivareta hensyn til arbeidsgiver med tanke
på utvikling, lønnsomhet, bærekraft og innovasjon, samt at arbeidstakervernet
blir ivaretatt. Velferdsordningene må utformes slik at det lønner
seg å arbeide, samtidig må personer som ikke makter å stå helt eller
delvis i arbeid, sikres et verdig liv med tilstrekkelig inntekt.
Dette medlem påpeker at et godt
arbeidsmiljø forutsetter et godt samarbeid mellom myndighetene,
arbeidsgiver og arbeidstaker. Det bør derfor jobbes aktivt for at
trepartssamarbeidet opprettholdes og utvikles på en god måte. Det
er viktig at det er en god balanse i forholdet, slik at man kan
få et bærekraftig arbeidsliv som gagner både det enkelte individ
og samfunnet.
Dette medlem vil også bemerke
at arbeid er viktig for menneskets egenverdi og selvfølelse. Mennesket
er skapt med ulike egenskaper, og ved å få bruke disse får mennesket
en følelse av verdi og nytte.Tilrettelegging for at mennesker får
bidra med sine evner og anlegg, er menneskeverd. På arbeidsplassen
møter man ulike mennesker og får tilgang til et sosialt nettverk, noe
som er helsebringende. Arbeid motvirker fattigdom, noe som er svært
viktig for den enkeltes utvikling og selvrespekt, og det gir den
enkelte frihet og mulighet til å være en del av samfunnslivet og
på den måten få lov til å være med og påvirke.
Familien er grunncellen i samfunnet og dermed en
stor ressurs for fellesskapet. Dette medlem mener
at det er viktig at myndighetene legger til rette for gode vilkår
for familien, hvilket er av stor betydning for samfunnet. Ulike
faser i livet krever mer fleksibilitet med hensyn til arbeidstider
og arbeidsmengde. Dette medlem mener det derfor må
være et livsfasetilpasset arbeidsliv, så sant arbeidets art tillater
det, slik at familieliv kan kombineres med arbeid, det være seg
omsorg for barn, syke eller eldre familiemedlemmer.
Dette medlem vil også påpeke
at mange innretter seg slik at den ene av foreldrene er hjemme eller
har redusert stilling når barna er små. Hvis denne forelderen blir
syk eller skadet, medfører dette ofte store problemer i hverdagen. Dette
medlem vil derfor bedre ordningene for rett til å være hjemme
med små barn ved sykdom til også å omfatte den andre forelderens
sykdom utover egenmeldingsdagene.
Dette medlem deler situasjonsbeskrivelsen som
legger til grunn at en har en vei å gå for at arbeidslivet skal
være helt tilfredsstillende på alle områder. Dette medlem er
enig i at Norge har utfordringer knyttet til blant annet sosial dumping,
helseproblemer, utstøting og ufrivillig deltid i norsk arbeidsliv. Dette
medlem vil i tillegg påpeke at det foreligger store problemer knyttet
til innpass i arbeidslivet for de som har nedsatt arbeidsevne og
funksjonsevne, samt for de med fremmedkulturell bakgrunn. I tillegg
vil dette medlem påpeke at det foreligger utfordringer
knyttet til gode ordninger for familier, seniorer og selvstendig
næringsdrivende. Dette medlem mener at disse gruppene
innehar verdifull kompetanse som man ikke har råd til å gå glipp
av, og det bør derfor foreligge gode ordninger for å inkludere alle
i arbeidslivet.
Levealderen i Norge øker, samtidig som mange personer
i pensjonsalder har gode forutsetninger for å være i arbeidslivet. Dette
medlem mener derfor at det bør legges mye bedre til rette
for at disse gruppene står i arbeid og får innpass i arbeidslivet
etter å ha falt utenfor. Norge vil på sikt trenge mange nye arbeidstakere,
og alle som ønsker og kan være i arbeid bør derfor få muligheten
til dette. Dette medlem mener at samfunnet ikke har
råd til å gå glipp av den kompetansen som seniorene besitter.
Det har i den senere tid vært ulike undersøkelser som
viser at det er store utfordringer knyttet til minoritetsspråkliges
mulighet til å få innpass i arbeidslivet. Med tanke på befolkningsveksten som
blant annet vil komme på grunn av økt innvandring, mener dette
medlem at det derfor er viktig å iverksette ulike tiltak
som kan utjevne forskjellene med tanke på tilgang til arbeidslivet. På
den måten kan man da også hindre sosial dumping.
I tillegg vil dette medlem legge
til grunn at det er viktig å ha gode ordninger som styrker rettighetene
til selvstendig næringsdrivende. Dette er viktig for å skape flere
bedrifter og arbeidsplasser og også for å sikre innovasjon. Dette medlem har
tidligere kommet med ulike forslag som skal bidra til å likestille
selvstendig næringsdrivende med vanlige arbeidstakere. Dette er
særdeles viktig for å sikre norsk konkurransekraft og opprettholde
et godt velferdssamfunn og bidra til økt levestandard i resten av
verden.
Dette medlem vil påpeke at Kristelig Folkeparti
tidligere har foreslått å gi selvstendig næringsdrivende rett til
