sakid,tittel,emneord,sammendrag
i regelverket med sikte på å gjøre det mer fleksibelt. Utvalget
viser til at det fra arbeidsgivers side handler om fleksibilitet,
først og fremst om muligheten til å tilpasse arbeidstiden etter
virksomhetens aktivitet.
Disse medlemmer mener at det
er på tide med en gjennomgang av arbeidstidsordningene i arbeidsmiljøloven,
og at det må gis mulighet for mer bruk av fleksible turnusordninger,
for å få ned blant annet andelen ufrivillig deltid, minske antall
lovbrudd og få flere til å klare å stå i jobb.
Disse medlemmer viser til at
Norge trenger mer arbeidskraft i tiden fremover. En realistisk, men
utfordrende måte å skaffe mer arbeidskraft på er blant annet å få
flere til å jobbe heltid. Et viktig bidrag for å få dette til er
å endre måten man i dag praktiserer arbeidstidsordningene på.
Disse medlemmer konstaterer at
utfordringene knyttet til praktiseringen av arbeidstidsbestemmelsene
er lite berørt i stortingsmeldingen.
Disse medlemmer foreslår at det
nedsettes en arbeidstidskommisjon som skal se på praktiseringen
av arbeidstidsbestemmelsene. En slik helhetlig og faglig gjennomgang
har ikke vært gjennomført tidligere.
Disse medlemmer mener målet med
kommisjonens arbeid må være å finne løsninger som kan
utløse arbeidskraft
på kort og lang sikt
øke andelen heltidsstillinger
sikre at virksomhetenes behov for drift
ivaretas, samtidig som arbeidstiden bedre kan tilpasses den enkelte
arbeidstaker
Disse medlemmer viser til at
yttergrensene i loven når det gjelder arbeidstid er viktige vernegrenser,
og at det ikke nødvendigvis er behov for å endre disse.
Disse medlemmer mener diskusjonen
i hovedsak må gå på hvordan arbeidstidsbestemmelsene praktiseres
innenfor disse vernegrensene.
Disse medlemmer fremmer på denne
bakgrunn følgende forslag:
«Stortinget ber regjeringen nedsette en arbeidstidskommisjon
som får til oppgave å se på praktiseringen av arbeidstidsbestemmelsene,
og hvor man blant annet legger frem forslag om
mer fleksible regler
for gjennomsnittsberegning av arbeidstid
mer fleksible regler for uttak av overtid
hvorvidt dagens regler for nattarbeid og
søndagsarbeid er hensiktsmessige
hvordan utløse mer arbeidskraft på kort
og lang sikt
øke andelen heltidsstillinger.»
Permittering
Komiteens flertall, medlemmene
fra Arbeiderpartiet, Sosialistisk Venstreparti og Senterpartiet,
slutter seg til at det ikke er behov for lovregulering av permitteringsinstituttet,
men understreker at god informasjon og drøfting med de ansatte om
forhold som kan føre til permittering, bør ivaretas av alle arbeidsgivere.
Plikten til informasjon og drøfting i arbeidsmiljøloven er viktig
for at tillitsvalgte skal kunne ivareta ansattes interesser, men omfatter
også representanter for de ansatte i virksomheter uten tariffavtale.
Komiteens medlemmer fra Fremskrittspartiet,
Høyre og Kristelig Folkeparti viser til at det per dags
dato ikke er lovregulert adgang til permittering for arbeidsgiver,
men det fremgår av praksis i arbeidslivet, rettspraksis og tariffavtaler.
I tillegg forutsettes det av en rekke bestemmelser en permitteringsadgang,
jf. folketrygdloven § 4-7, samt permitteringsloven av 6. mai 1988
nr. 22.
Disse medlemmer mener det er
positivt at bedrifter og ansatte organiserer seg, men vil understreke
at medlemskap i både ansatte- og arbeidsgiverorganisasjoner er frivillig.
Det betyr at selv om dagens permitteringsordninger fungerer godt
i bedrifter med tariffavtale, er det rundt 600 000 ansatte i privat
sektor som ikke er fagorganiserte. Permitteringsreglene i bedrifter
uten tariffavtale baserer seg i dag ikke på et klart lovverk, men
på praksis utviklet i domstolene.
Disse medlemmer mener det foreligger
et behov for kodifisering av permitteringsreglene. Det er ikke nytt
i Norge at avtaler mellom partene i arbeidslivet siden legger grunnlaget
for lovgivning som gjelder for alle. Særlig er det viktig å sikre
at alle ansatte har en rimelig rett til informasjon så tidlig som
mulig dersom virksomheten planlegger permitteringer.
Disse medlemmer mener det er
en vesensforskjell mellom kollektive samtaler mellom fagforening
og bedrift, og en eventuell individuell rett til samtaler med arbeidsgiver
i en permitteringssituasjon. De ansatte bør i alle tilfeller bli hørt,
men en individuell rett til samtaler vil være både tidkrevende og
byråkratisk, samt risikere å underminere permitteringsinstituttets
nødvendige fleksibilitet. Disse medlemmer mener det bør
være drøftelser med de ansatte også når disse er ikke-organisert,
men mener ikke disse drøftingenes bestemte karakter bør fastsettes
gjennom lovverket.
Disse medlemmer vil advare mot
å gi ikke-organiserte arbeidstakere bedre vilkår enn ansatte som
er organisert og omfattet av avtalefestede bestemmelser, men støtter
samtidig en endring i lovverket som gir også ikke-organiserte en
bedre beskyttelse enn i dag.
Disse medlemmer ønsker derfor
at regjeringen utarbeider et lovforslag som er basert på avtaleverket,
men som sikrer at man ikke får to forskjellige systemer for informasjon
avhengig av om man er organisert eller ikke.
Disse medlemmer fremmer på denne
bakgrunn følgende forslag:
«Stortinget ber regjeringen fremme et lovforslag som
regulerer permitteringsreglene også for ikke-organiserte arbeidstakere.»
Komiteens medlemmer fra Fremskrittspartiet viser
til at Fremskrittspartiets forslag om endringer i arbeidsmiljøloven
om lovfesting av permitteringer omtales i meldingen, og det konkluderes
med at det ikke er behov for en lovregulering av permitteringsinstituttet.
Disse medlemmer registrerer at
regjeringen har foreslått at det vil bli sendt ut på høring, forslag
om en endring i virkeområdet for reglene for å sikre alle arbeidstakere
rett til god informasjon og drøfting. I dag gjelder drøftingsplikten
bare for de med minst 50 arbeidstakere.
Disse medlemmer viser til at
Fremskrittspartiet tidligere har fremmet forslag om lovfestet rett
til permittering. Dette er med bakgrunn i at uorganiserte arbeidstakere
blir diskriminert, når de ikke har de samme rettigheter som arbeidstakere
som er organisert, ved drøftelser og informasjon ved permittering,
jf. Representantforslag 63 L (2010–2011) om lov om endringer i arbeidsmiljøloven
(lovregulering av permitteringer), Innst. 247 L (2010–2011).
Disse medlemmer viser også til
at regjeringen under finanskrisen i 2009 utvidet dagpenge- og permitteringsordningen,
for å gjøre det lettere for arbeidsgiver å holde på kvalifisert
arbeidskraft, i en periode med lav aktivitet og nedgangskonjunktur.
I statsbudsjettet for 2012 valgte regjeringen å reversere ordningen,
med begrunnelse i den bedrede situa-sjonen på arbeidsmarkedet. Disse
medlemmer er uenig med regjeringen i reverseringen av dagpenge-
og permitteringsordningen som ble utvidet i 2009.
Disse medlemmer mener at utvidelsen
av permitteringsordningen må opprettholdes, nettopp fordi regjeringen
viser til at den økonomiske uroen i finansmarkedet utenfor Norge også
kan ramme oss.
Disse medlemmer viser til at
Fremskrittspartiet i sitt alternative statsbudsjett for 2012, samt Innst.
2 S (2011–2012), fremmet følgende forslag, sitat:
«Stortinget ber regjeringen sørge for at regelverket
for permitteringsordningen beholdes uendret.»
Disse medlemmer påpeker at det
i januar i fjor kom en presisering om gjeldende regler for dagpenger
under permittering ved sesongarbeid. Forskriften innehar en strengere
fortolkning av sesongarbeid.
Disse medlemmer mener at det
er forskjell på sesongbetonte yrker, som fiske og landbruk, hvor
inntekten fordeles over hele året, og hotell- eller anleggsarbeid,
som er mer sesongvariert. Disse medlemmer mener derfor
at permisjon i henhold til lov om permittering må innebære at den
permitterte gis rett til dagpenger.
Disse medlemmer fremmer på denne
bakgrunn følgende forslag:
«Stortinget ber regjeringen legge frem for Stortinget
en gjennomgang av reglene for permittering sett opp mot reglene
for dagpenger. »
To og trepartssamarbeidet-det organiserte arbeidslivet
Komiteen peker på
at den norske arbeidslivsmodellen med sterke organisasjoner i arbeidslivet
og godt trepartssamarbeid har lagt grunnlaget for det velfungerende
arbeidslivet i Norge, kjennetegnet av høy kvalitet på helse, miljø
og sikkerhet, høy sysselsetting, lav konfliktgrad, koordinert lønnsdannelse
og attraktivitet og konkurransedyktighet. Komiteen påpeker
at partssamarbeidet i norsk arbeidsliv er mangfoldig, og er av stor
verdi både for samfunnet i sin helhet, arbeidsforholdene og produktiviteten
i virksomhetene samt for medvirkningen og innflytelsen for den enkelte
arbeidstaker.
Komiteen vil fremheve viktigheten
av satsing på treparts bransjeprogram for å styrke trepartssamarbeidet
og mobilisere partene til å ta tak i arbeidsmiljøutfordringer i
spesielt utsatte bransjer. Komiteen merket seg i
høringen til stortingsmeldingen ønsket om bransjeprogram for uteliv,
fremmet av arbeidsgiverorganisasjonen Virke.
Komiteen merker seg at de ulike
ordningene for medbestemmelse i arbeidslivet ikke følges opp i mange
virksomheter, og at ordningene ofte ikke praktiseres etter hensikten.
At to av ti virksomheter ikke har opprettet verneombud og at mange
virksomheter ikke opererer med arbeidsmiljøutvalg, viser etter komiteens mening
behovet for økt fokus og tiltak på dette området. Komiteen fremhever
viktigheten av at de ulike ordningene for medvirkning og bedriftsdemokrati,
som forankret i ulik lovgivning, følges, og at kunnskapen om ordningene
og rettighetene og pliktene derfor styrkes med sikte på bedre oppfølging
og dermed bedre medvirkning. Komiteen vil understreke
at reelt og likestilt samarbeid og medvirkning er særlig viktig
for å sikre omstillingsevne i virksomheter.
Komiteen peker videre økningen
av arbeidsinnvandrere med lavere kunnskap om arbeidslivstandardene
som en viktig utfordring. Komiteen merker seg regjeringens
forslag til tiltak for å styrke omfanget av og etterfølgelsen av
medvirkning og medbestemmelsesordningene, deriblant økt kunnskap,
forenkling av regelverk, gjennomgang av og klargjøring av verneorganisasjonens
rolle med tanke på styrking, undersøkelsesplikt for arbeidsgiver
med henhold til styrerepresentasjon, etablering av konsernordninger,
m.m.
Komiteens flertall,
alle unntatt medlemmene fra Fremskrittspartiet, merker seg at regjeringen
vil tilrettelegge for gode samarbeidsarenaer mellom partene både
lokalt, regionalt og nasjonalt. Flertallet støtter
ønsket om å styrke partssamarbeidet ytterligere, som et av de viktigste
virkemidlene for å fortsatt fremme et anstendig inkluderende og
stabilt arbeidsliv og bærekraftig samfunn.
Flertallet viser til at et viktig
virkemiddel i denne sammenheng er styrking av organisasjonsgraden,
både på arbeidsgiver- og arbeidstakersiden. Flertallet merker
seg at til tross for at så mange som over halvparten av norske arbeidstakere
er organiserte, har andelen jevnt gått ned siden 1995, men at den
steg fra 2008–2009 med 1 prosentpoeng. Flertallet har
merket seg at organisasjonsgraden øker med utdanningsnivået – særlig
i privat sektor. Flertallet ser det som en utfordring
at de som har de mest usikre arbeidsforholdene – for eksempel midlertidig ansettelse,
lav ansiennitet eller ekstrajobb ved siden av studium, og som arbeider
i bransjer som er preget av useriøsitet og sosial dumping – er blant
de som sjeldnest er medlemmer i en fagforening eller en arbeidstakerorganisasjon.
Et annet flertall,
alle unntatt medlemmene fra Fremskrittspartiet og Høyre, støtter
regjeringens arbeid for og forslag til tiltak for økt organisasjonsgrad. Dette
flertallet viser til skattefradrag for fagforeningskontingent
som ett godt virkemiddel for å høyne organisasjonsgraden.
Komiteens medlemmer fra Fremskrittspartiet,
Høyre og Kristelig Folkeparti er bekymret for at trepartssamarbeidet
svekkes under den rød-grønne regjeringen. NHO uttalte 26. november
2011 at regjeringens fremgangsmåte i arbeidet med arbeidslivsmeldingen «setter
[trepartssamarbeidet] under kraftig press». Også arbeidstakerorganisasjoner
har vært kritiske til det de ser som en urimelig favorisering av
en bestemt fagorganisasjon. I Klassekampen 6. mars 2012 uttalte
Tore Eugen Kvalheim, leder i YS følgende, sitat:
«Regjeringen legger mye vekt på dialog med «partene
i arbeidslivet», men snakker mest og best med én part. (…) Det holder
ikke å bare snakke med LO.»
Komiteens medlemmer fra Fremskrittspartiet viser
til at Fremskrittspartiet er for organisasjonsfrihet. Disse
medlemmer mener at det ikke skal være avgjørende at man
er organisert i en fagforening, for å få like rettigheter i arbeidslivet.
Disse medlemmer vil ha mer lokal
medbestemmelse, og mener at det er de lokale parter som best er
i stand til å avgjøre lokale arbeidsforhold ved den enkelte arbeidsplass.
Fremskrittspartiet vil derfor fjerne vetoretten til fagforeninger
med innstillingsrett i arbeidsmiljøloven.
Disse medlemmer viser til at
Fremskrittspartiet har støttet trepartssamarbeidet gjennom et styrket
offentlig tilsyn, og støtter derfor ikke regional verneombudsordning
i hotell- og restaurantbransjen og i renholdsbransjen. Innsatsen mot
lovbrudd må skje ved at partene i arbeidslivet og det offentlige
samarbeider tett. Tilsynsmyndighet er et offentlig ansvar som ikke
kan privatiseres eller settes bort.
Komiteens medlemmer fra Høyre er
enige i at det er viktig å legge til rette for et velfungerende
arbeidsmarked hvor det er ordnede forhold for arbeidstaker og arbeidsgiver. Disse medlemmer mener
at fradragsretten er et verktøy for å ha en høy andel fagorganiserte
i arbeidslivet og viser til at det er bred enighet på Stortinget
om retten til å organisere seg, men vil påpeke at det har vært politisk
uenighet om størrelsen på fradragsbeløpet.
Arbeidsmiljø, helse ,miljø og sikkerhet
Komiteen peker på
at selv om kvaliteten i det norske arbeidslivet er god, og Norge
scorer høyt i internasjonale arbeidsmiljøundersøkelser og en stadig
færre andel arbeidstakere eksponeres for negative arbeidsmiljøbelastninger
på mange områder, har Norge fortsatt store utfordringer. Komiteen understreker
at høye arbeidsmiljøbelastninger kan føre til helseskader, sykefravær,
utstøting og lavere produktivitet. Dette er ikke bare et alvorlig
problem for den enkelte, men også for samfunnet og virksomhetene. Komiteen peker
på at enkelte yrkesgrupper fortsatt har en vesentlig høyere arbeidsmiljøbelastning
enn andre arbeidstakere, og at på enkelte arbeidsmiljøindikatorer
går utviklingen i negativ retning. Komiteen merker seg
at innvandrere oftere rapporterer om belastninger og ulykker i arbeidslivet
enn resten av befolkningen.
Komiteen merker seg at tradisjonelle
arbeidsmiljøpåkjenninger slik som eksponering for kjemikalier, skadelig
støy og nattarbeid, fortsatt står for en stor andel av arbeidsrelaterte
helseplager.
Komiteen peker på at selv om
HMS-undersøkelsen fra 2009 viser en forbedring i virksomhetenes
arbeid sammenlignet med undersøkelsen fra 1999, er det et stort
forbedringspotensial og behov for styrking av HMS-opplæring, oppfølging
av Internkontrollforskriften og HMS-arbeidet i praksis ute i virksomhetene.
Komiteens flertall,
alle unntatt medlemmene fra Fremskrittspartiet og Høyre, peker på
at trenden med endring i eier-, organisasjons- og styringsstrukturer
fører til at andre enn arbeidsgiveren får økt innflytelse over virksomhetene,
for eksempel i konsern og i franchisevirksomheter, eller virksomheter
som stykkes opp ved utsetting av oppgaver til underleverandører.
Dette utfordrer, etter flertallets mening, arbeidstakers
rett til innflytelse på eget arbeidsforhold og arbeidsmiljø, og
utviklingen kan på sikt undergrave den norske modellen.
Komiteen peker derfor
på behovet for for-bedringer på ulike områder for på kort og lang sikt
styrke virksomhetenes systematiske HMS-arbeid. Økt kunnskap om arbeidsmiljøkrav
og opplæring i HMS-arbeid er etter komiteens mening
avgjørende, noe også tilstandsrapporten i meldingen klart peker
på.
Komiteens flertall, medlemmene
fra Arbeiderpartiet, Sosialistisk Venstreparti og Senterpartiet,
viser til at regelverket og regelverksutformingen for å sikre godt arbeidsmiljø
kan være en utfordring i bransjer som er preget av mange små virksomheter
som for eksempel i landbruket. Hensynet til slike bransjer tilsier
at man bør sikre et regelverk som både er enkelt å forstå og lett
tilgjengelig.
Komiteen mener at
det i tillegg er viktig å sikre at HMS-regelverket forankret i ulik
lovgivning etterfølges bedre enn i dag. Komiteen har
i høringen merket seg en økende bekymring rundt underrapportering
av arbeidsulykker og skader grunnet mangelfull samlet registrering. Komiteen imøteser
derfor regjeringens forslag til tiltak, deriblant nytt og forenklet
helse-, miljø- og sikkerhetsregelverk under arbeidsmiljøloven, informasjons-
og opplæringsarbeid forankret i trepartsamarbeidet, bedre HMS-opplæring
i skolen, og mener regjeringen må forsterke arbeidsgivers plikt
til å gjennomgå tilpasset HMS-opplæring.
Komiteen peker på bedriftshelsetjenestens viktige
rolle i det langsiktige og akutte HMS-arbeidet i virksomheter, og
mener det er nødvendig med en kontinuerlig oppdatering av bransjeforskriften
slik regjeringen nå foreslår, slik at de reelle risikobransjene
faller inn under forskriftens område.
Komiteen viser til den høye andelen
inn-vandrere og arbeidsinnvandrere som utsettes for arbeidsmiljøbelastninger
og skade, og peker på at mangelfull språkkompetanse ofte er årsak
til dette.
Komiteens flertall,
alle unntatt medlemmene fra Fremskrittspartiet, støtter videre de
foreslåtte tiltak på kjemikalieområdet, varslede endringer i støyforskriften
og bedre kunnskap om og etterlevelse av arbeidstidsordningenes regulering
av nattarbeid.
Komiteens medlemmer fra Fremskrittspartiet viser
til at Fremskrittspartiet har økt fokus på tiltak på kjemikalieområdet
og varslede endringer i støyforskriften. Disse medlemmer viser
til Fremskrittspartiets forslag om å nedsette en arbeidstidskommisjon
for å se på arbeidstidsordningene i arbeidsmiljøloven.
Komiteen påpeker videre
viktigheten av forebygging av arbeidsrelatert skade og sykdom. Det er
også viktig å sikre god gjennomføring av IA-avtalen, og oppdatert
og kvalitetsmessig god kunnskap om bransjevis tilstand, utfordringer
og historikk knyttet til skade. Dette er ikke minst avgjørende for
tilsynenes mulighet til å drive effektivt og bruke sine ressurser
målrettet. Komiteen har merket seg behovet for en
bedre og mer samlet registrering av yrkesrelaterte skader, og mener
dette er viktig for å gjøre arbeidet med forebygging og kontroll
mer effektivt, oppdatert og relevant. Komiteen understreker
at kunnskap for å forebygge stress og slitasje i service- og omsorgsyrker
må vektlegges, med særlig vekt på de utbredte slitasjeplagene høy arbeidsintensitet
fortsatt medfører. Komiteen imøteser at regjeringen
nå varsler flere tiltak for å forbedre registrering, statistikk
og dokumentasjon på området.
Komiteen understreker ambisjonen
om at norsk petroleumsvirksomhet skal være verdensledende innen
HMS. Komiteen mener at selv om helse-, miljø- og
sikkerhetsstandarden på norsk sokkel i et tiårsperspektiv er forbedret
og i all hovedsak er god, så gir enkelte alvorlige hendelser i den
senere tid, sammen med visse utviklingstrekk, grunn til økt oppmerksomhet
på sektoren. Komiteen støtter derfor en egen helhetlig
gjennomgang av HMS-regimet i sektoren, som varslet i meldingen.
Videre påpeker komiteen viktigheten av et reelt og
godt fungerende likeverdig trepartssamarbeid i denne sektoren.
Komiteen viser til at Europakommisjonen
i oktober 2011 la frem forslag til forordning om sikkerhet for offshore
olje- og gassvirksomhet. Forslaget er fremmet som et ledd i kommisjonens
arbeid med oppfølging etter ulykken i Mexicogulfen i april 2010. Komiteen viser
til at forslaget ble tatt opp under høringen, og komiteens mener
forslaget ikke plasserer ansvaret for sikker drift og beredskap
i petroleumsvirksomheten på samme entydige måte som norsk lov og
regelverk gjør. Et hovedprinsipp i det norske HMS-regimet er at
ansvaret for sikker drift og beredskap i petroleumsvirksomheten
er plassert hos næringen selv. HMS-nivået i norsk petro-leumsvirksomhet
er høyt. Komiteen viser til at forordningen ikke
anses som EØS-relevant, jf. utenriksministerens redegjørelse til
Stortinget om relevante EØS-spørsmål 8.  mai 2012.
Komiteen mener for øvrig at forslaget
ikke vil bidra til å styrke sikkerhetsnivået på norsk sokkel, og
ønsker derfor at forordningen ikke skal innlemmes i norsk rett.
Komiteen viser til at det under
høringen ble pekt på problemet med vold og trusler mot ansatte i
offentlig tjenesteyting, spesielt i yrker som ivaretar vanskelige
helse- og sosialfaglige avgjørelser, grensedragninger og tvangstiltak.
Komiteen peker på at arbeidsmiljøloven
har klare bestemmelser om at arbeidstaker skal beskyttes mot dette
så langt det er mulig. Undersøkelser (AFI-rapporter fra 1996, Rapport
1/96 og J. Svalund i 2009) tyder på at omfanget av trusler og vold
øker. I 2009 oppgav ca. 60 pst. av ansatte i barnevern og i arbeid
med psykisk utviklingshemmede, at de hadde opplevd dette. Omkostningene
kan være mange og ulike, som for eksempel fysiske og psykiske senskader, lange
sykmeldinger og utrygt arbeidsmiljø. Å forebygge ved å ha klare
retningslinjer og prosedyrer for å beskytte arbeidstakere, melde fra
om og følge opp når skade har skjedd er, etter komiteens mening,
nødvendig og i tråd med bestemmelsene i AML. Arbeidet med å redusere omfanget
av dette bør, etter komiteens mening, intensiveres
og følges opp med eventuelle nødvendige presiseringer i rundskriv,
opplæring og kunnskap om faktorer som reduserer omfanget av vold
og trusler mot ansatte samt økt tilsyn.
Komiteens medlemmer fra Fremskrittspartiet mener
at Arbeidstilsynet har en viktig oppgave i å påse et forsvarlig
og systematisk HMS- arbeid på norske arbeidsplasser.
Disse medlemmer viser til at
Arbeidstilsynet er blitt pålagt flere oppgaver og har fått flere
tilsynskontroller. Ressurser som er tilgjengelig skal også rekke
til forebygging av arbeidsrelaterte sykdommer, skader og ulykker.
Disse medlemmer mener også at
arbeidstilsynets arbeid har ført til en bedring i HMS-arbeidet i
virksomheter der tilsynet ofte har utført kontroll.
Disse medlemmer viser til programmet «Brennpunkt»
27. september 2011 på NRK, der det ble nevnt at bekymringsmeldinger
til Arbeidstilsynet ikke blir besvart, noe som er uheldig. Det kan
føre til at mange vegrer seg for å melde ifra om alvorlige brudd
på arbeidsmiljøloven, og at useriøse bedrifter ikke blir avslørt.
Disse medlemmer mener at det
fortsatt ligger et potensial til forenkling i lovverket som Arbeidstilsynet
er satt til å forvalte.
Disse medlemmer mener at Arbeidstilsynet og
Petroleumstilsynet har sammenfallende oppgaver selv om de forvalter
ulike områder.
Disse medlemmer er imot sosial
dumping og mener at et styrket tilsyn kan bidra til å luke ut useriøse
aktører i arbeidslivet, og påpeker samtidig at Arbeidstilsynet har
en viktig oppgave med å kontrollere at det offentlige ivaretar sine
arbeidsrettslige forpliktelser på lik linje som private virksomheter.
Disse medlemmer mener at det
er behov for å styrke tilsynskompetansen, samt sikre en mer robust
tilsynsenhet. Disse medlemmer viser til at det ikke
har vært dødsulykker innenfor Petroleumstilsynets myndighetsområde,
noe som er positivt. Disse medlemmer påpeker derimot
at det har vært flere nestenulykker innen tilsynets myndighetsområde,
og at det fortsatt har vært alvorlige personskader i virksomheter
til havs, selv om det er en reduksjon fra 32 i 2009 til 28 i 2010.
Disse medlemmer mener derfor
at HMS-arbeidet må styrkes under Petroleumstilsynets myndighetsområde. Disse
medlemmer mener også at Arbeidstilsynet og Petroleumstilsynet har
sammenliknbare tilsynsoppgaver, og mener at det ligger et effektiviseringspotensial
i en sammenslåing av Arbeidstilsynet og Petroleumstilsynet, slik
at man samler fagkompetansen på ett sted.
Forskningsbehov, utdanningstilbud og 
fagkompetanse
Komiteen understreker
hvor viktig det er med oppdatert kunnskap om skadelige forhold i
arbeidslivet. Kunnskap er nødvendig for å kunne iverksette forebyggende
tiltak og bedre arbeidsmiljøet.
Komiteen ser på STAMIs koordinerende
rolle på det medisinske feltet som en styrking for formidling av
resultater til beslutningstakere både for virksomheter og myndigheter.
Komiteen mener at høyere utdanning
må være preget av kompetanse, kvalitet, mangfold og like rettigheter.
Det er viktig at utdanningspolitikken er fremtidsrettet og ivaretar
viktige samfunnsmessige behov, samtidig som den legger til rette for
at den enkelte får mulighet til å bruke sine evner på en best mulig
måte. Frafallet i videregående skole er betydelig, spesielt når
det gjelder de yrkesrettede fag.
Komiteen mener derfor at rådgivningstjenesten
i ungdoms- og videregående skole bør styrkes for å hindre det store
frafallet. Riktig veiledning som er tilpasset den enkelte elev,
kan medføre at man kommer tidligere inn på riktig kurs og slipper
å ta unødvendige omveier. Komiteen mener at dette
både vil være et gode for det enkelte individ, samt at det vil være
samfunnsøkonomisk.
Komiteen mener at for at Norge
i fremtiden skal være et konkurransedyktig kunnskapssamfunn, må
vi satse på forskning. Verdien av vår kunnskap er langt større enn
verdien av oljeressursene, derfor er det helt nødvendig med en god høyere
utdanning og satsing på forskning for å sikre landets fremtid. Universitetene
må legge til rette for solide fagmiljøer som også danner grunnlaget
for forskning og ny kunnskap. I en tid som preges av større mangfold,
