sakid,tittel,emneord,sammendrag
er i drifta av verksemda som kan utgjere ein risiko for helse og
sikkerheit for arbeidstakarane, og driv systematisk førebyggjande
arbeid. Vidare er det i ein god del tilfelle behov for tilrettelegging
og samarbeid om gode løysingar for arbeidstakarar som er sjuke, har
redusert arbeidsevne eller som har ulike omsorgsoppgåver.
Både ved overvaking av arbeidsmiljøet, førebygging
av helseskadar og ved tilrettelegging for arbeidstakarar med redusert
arbeidsevne vil bedriftshelsetenesta i mange tilfelle vere ein svært verdifull
samarbeidspartnar. Bedriftshelsetenesta har fått eit lyft ved at
ei godkjenningsordning for bedriftshelsetenester er innført, og
ved å gjere bedriftshelseteneste obligatorisk i fleire bransjar.
Departementet vil følgje opp at desse tiltaka verkar slik dei er
tenkte.
Det er viktig at dei verksemdene som har plikt
til å knyte til seg bedriftshelseteneste, gjer det og aktivt bruker
tenesta i HMS-arbeidet sitt.
Det er behov for endring eller forbetring på
fleire område, som både på kort og lang sikt kan styrkje verksemdene
sitt eige systematiske HMS-arbeid. Kapittel 15 i medlinga drøftar
korleis verksemdene sitt arbeid på desse felta kan forbetrast.
Informasjonsarbeid og opplæringsarbeid
Det er viktig å auke kunnskapen om arbeidsmiljøkrav
og gjere HMS-regelverket meir tilgjengeleg. Det blir arbeidd med
sikte på eit informasjons-, opplærings- og haldningsopplegg om det
førebyggjande arbeidsmiljøarbeidet i norsk arbeidsliv. Ein viktig
grunn til å setje i gang eit slikt arbeid er at eit nytt helse-,
miljø- og sikkerheitsregelverk under arbeidsmiljølova etter planen
skal vere ferdig i løpet av 2011. Dei fleste HMS-forskriftene under
arbeidsmiljølova vil inngå i ein heilt ny struktur, og det gir høve
til å styrkje kunnskapen om det materielle innhaldet i regelverket,
noko som er ein føresetnad for HMS-arbeidet. Opplæringa skal planleggjast
og gjennomførast i samarbeid med partane.
Utvida HMS-ansvar i konsern- og 
franchiseforhold
Det er grunn til å stille spørsmål ved om den
reguleringa som gjeld i dag, der arbeidsgivaren åleine har ansvar
for at krava til arbeidsmiljø og arbeidsforhold er oppfylte, er
tilstrekkeleg. Endringar i eigar-, organisasjons- og styringsstrukturar
har ført til at andre enn arbeidsgivaren kan ha betydeleg innverknad
over verksemda, til dømes i konsern og franchiseforhold. Tilsvarande
gjeld der det som tidlegare var organisert som éi verksemd, er stykkja
opp gjennom til dømes utsetjing av oppgåver til underleverandørar.
Dette er former for organisering som har blitt meir og meir vanlege,
og som omfattar ei betydeleg mengd arbeidstakarar. Det er ikkje urimeleg
at retten til innverknad som har konsekvensar for arbeidsmiljøet
til den enkelte arbeidstakaren, bør få følgje av eit visst ansvar
for HMS, særleg i konsern og til ein viss grad i franchiseforhold.
Ved bruk av anbod kan dessutan kontraktvilkåra vere
viktige for arbeidsforholdet og arbeidsmiljøet til dei arbeidstakarane
som skal utføre arbeidet. Eit tiltak, som til dømes er ei eller
anna form for bestillaransvar, blir omtalt i meldinga.
Dette inneber at det ikkje vil foreslåast ei
generell utviding av arbeidsgivaromgrepet i arbeidsmiljølova.
Det vil derfor bli utarbeidd eit høyringsnotat
der ein vurderar å innføre eit «utvida HMS-ansvar» i konsern- og
franchiseforhold.
HMS-opplæring
Vidare blir behovet for å styrkje lovføresegna sitt
krav om tilpassing av HMS-opplæringa til den enkelte verksemda drøfta.
Ei undersøking frå 2009 viser at berre éin av fire arbeidsgivarar har
gjennomført lovpålagt HMS-opplæring, og at innhaldet og lengda på
opplæringa varierer. Det er derfor sett i gang ei kartlegging og
ein analyse av opplæringstilbodet. Vurdering av behovet for å styrkje
HMS-kompetansen til arbeidsgivarane vil bli vurdert når kartlegginga
ligg føre.
Også blant arbeidstakarane er HMS-opplæringa mangelfull.
Mange unge fullfører ikkje vidaregåande opplæring og går rett ut
i arbeidslivet utan gode nok HMS-kunnskapar. Det er bekymringsfullt
at dei yngste arbeidstakarane har ein mykje større risiko enn eldre
arbeidstakarar for å bli utsette for ei arbeids-ulykke.
Behovet for å styrkje HMS-kompetansen til arbeidsgivarane
og lovføresegna sitt krav om tilpassing av HMS-opplæringa til den
enkelte verksemda vil bli vurdert når kartlegginga av HMS-opplæringstilbodet
ligg føre.
I kapitlet blir behovet for ein meir målretta innsats
innanfor HMS-opplæringa i skulen drøfta. Arbeidstilsynet har sett
i verk ei rekkje tiltak for å styrkje HMS i fagopplæringa. Det vil
bli teke initiativ til eit tettare og meir aktivt samarbeid for
å forbetre HMS-opplæringa i skulen, mellom anna eventuelt ein samarbeidsavtale mellom
Arbeidstilsynet og Samarbeidsrådet for yrkesopplæring.
Arbeidstakaromgrepet
I kapittel 15.7 i medlinga blir det drøfta om
arbeidstakaromgrepet i arbeidsmiljølova bør utvidast. Spesielt ser
ein på om lova gir rom for omgåingar. Det er mange verksemder som
brukar sjølvstendige oppdragstakarar framfor arbeidstakarar, og
det kan stillast spørsmål ved om dei gjer dette for å unngå å bli
fanga opp av arbeidstakaromgrepet i arbeidsmiljølova. Problemstillinga
blir særleg sett på spissen der personar er organiserte som eit
enkeltmannsføretak og utfører oppdrag hovudsakleg for éin oppdragsgivar.
Oppdragsgivaren vil her i realiteten utøve arbeidsgivarfunksjonar,
slik at oppdragstakaren ikkje har sjølvstendig ansvar for utføringa
av arbeidet. Dette synest spesielt å vere aktuelt i bygg- og anleggsbransjen
og for enkelte stillingar i kommunal sektor. Ved å bruke oppdragstakarar
i staden for arbeidstakarar unngår ein langt på veg at føresegnene
i arbeidsmiljølova kan brukast på forholdet. Med andre ord inneber dette
ein fare for omgåing av reglane om stillingsvern, arbeidstid og
permisjon, for å nemne noko.
Det avgjerande for å bli fanga opp av arbeidsmiljølova
er om ein person reelt er arbeidstakar, ikkje korleis partane har
innretta seg. Rettstilstanden i dag fangar opp dei som reelt sett
er arbeidstakarar, og vil derfor ikkje foreslå endringar i arbeidsmiljølova
på dette punktet.
Tiltak:
Departementet vil
utarbeide eit høyringsnotat der ein vurderer å innføre eit «utvida
HMS-ansvar» i konsern- og franchiseforhold.
Departementet vil i samarbeid med partane
og Arbeidstilsynet foreslå å planleggje og gjennomføre eit informasjons-
og opplæringsarbeid.
Departementet vil vurdere om det er behov
for å forsterke føresegna om arbeidsgivaren si plikt til å gjennomgå
opplæring, for å tydeleggjere formålet med føresegna. Dette gjeld
krav om tilpassing av opplæringa til den enkelte verksemda.
Det vil bli teke initiativ til eit tettare
og meir aktivt samarbeid for å forbetre HMS-opplæringa i skulen,
mellom anna eventuelt ein samarbeidsavtale mellom Arbeidstilsynet
og Samarbeidsrådet for yrkesopplæring.
3.5	Tiltak for å styrkje tilsyna
3.5.1	Sammendrag
Sjølv om det er arbeidsgivaren som har ansvaret for
at krava i lova blir etterlevde, og sjølv om departementet i denne
meldinga understrekar partane sitt ansvar for å bidra i endå sterkare
grad, er også styresmaktene si handheving av lova viktig. Særleg
viktig er dette når det gjeld den meir useriøse delen av arbeidslivet.
Kapittel 16 i meldinga handlar i hovudsak om verksemda
til Arbeidstilsynet. Kapitlet blir derfor innleidd med ein generell
omtale av strategien og arbeidet i Arbeidstilsynet, og korleis dette
har utvikla seg dei siste åra. Dei tre konkrete tiltaka som blir
drøfta, kan likevel også omfatte Petroleumstilsynet. Petroleumstilsynet
er omtalt i eit eige kapittel (kapittel 20 i medlinga).
Samarbeid og koordinering mellom 
HMS-tilsyna og andre offentlege etatar
Arbeidstilsynet og Petroleumstilsynet samarbeider
med ei rekkje offentlege etatar for å oppnå størst mogleg effekt
av ressursar og handheving og for å sikre god informasjonsutveksling.
Særleg gjeld dette i arbeidet mot sosial dumping. Også ei rekkje
tilsyn eller direktorat følgjer opp regelverket på HMS-området.
Styresmaktene si oppfølging av HMS-arbeidet i verksemdene bør vere
einskapleg og effektiv. Etatane som har ansvaret for dei ulike helse-,
miljø- og sikkerheitsføresegnene og skal bidra til at verksemdene
driv forsvarleg, har til dels same målgruppe, men ulike ansvarsområde.
Dette inneber ein risiko for at verksemdene det blir ført tilsyn
med, får besøk av ulike etatar til ulike tider, at avgjerder blir tekne
av ulike etatar utan at ein sikrar at dei ikkje kjem i motstrid
med kvarandre, og at regelverket samla sett trekkjer i ulike retningar.
Samtidig har brukarundersøkingar vist at verksemdene ønskjer kompetente
tilsyn, som har fagkunnskap om dei enkelte områda. Det er derfor
eit mål for tilsynsetatane på HMS-området at det utoverretta tilsynsarbeidet
er mest mogleg samordna og einskapleg. Dette punktet behandlar Arbeidstilsynet
og Petroleumstilsynet sine koordineringsroller og koordineringsarbeidet
mellom HMS-etatane som blir gjennomført for å følgje opp desse utfordringane.
Tilsyn med det offentlege som oppdragsgivar
Offentleg sektor har eit særleg ansvar for å
bidra til ryddige forhold i norsk arbeidsliv, motverke dårlege arbeidsforhold
og sosial dumping og medverke til at utanlandske arbeidstakarar
ikkje blir utnytta på den norske arbeidsmarknaden. Dette ansvaret
blir oppfylt mellom anna ved å sikre at lønn og andre arbeidsvilkår
er i samsvar med minimumsvilkåra i tariffavtalar eller allmenngjeringsforskrifter.
Arbeidstilsynet og Petroleumstilsynet fører
tilsyn med lønns- og arbeidsvilkår etter utlendingslova og allmenngjeringsforskrifter. Arbeidstilsynet
bør få tilsynskompetanse etter forskrifta om lønns- og arbeidsvilkår
i offentlege kontraktar. Sjølv innanfor allmenngjorde område, der
tilsynsetatane kan ha kontakt med kvar enkelt arbeidsgivar, og også
har rett til å kontrollere om hovudleverandøren har oppfylt informasjons-
og samsvarsplikta, vil det vere for-måls-tenleg å kunne vende seg
direkte til det offentlege som oppdragsgivar/byggherre og kontrollere
at dei har følgt opp ansvaret sitt etter forskrifta.
Departementet vil på denne bakgrunn sende på høyring
eit forslag om å gi Arbeidstilsynet tilsynskompetanse etter forskrift
om lønns- og arbeidsvilkår i offentlige kontrakter (ILO 94).
Lovbrotsgebyr
I kapittel 16.4 i medlinga blir det drøfta om
Arbeidstilsynet og Petroleumstilsynet bør kunne ha høve til å påleggje
verksemder som har brote eller bryt arbeidsmiljøregelverket, eit
lovbrotsgebyr administrativt. Det er reist spørsmål ved om dei verkemidla
Arbeidstilsynet og Petroleumstilsynet rår over, er tilstrekkelege
til at etatane kan føre eit formålstenleg tilsyn med lovverket,
og om arbeidsgivarane gjer nok for å etterleve krava i arbeidsmiljølovgivinga.
Særleg er spørsmålet reist i lys av kampen mot sosial dumping.
For at reglane skal verke slik dei var tenkte,
må dei respekterast og etterlevast. Derfor må Arbeidstilsynet og
Petroleumstilsynet ha tilstrekkelege og formålstenlege reaksjonsmiddel
til rådvelde. Dei reaksjonsmidla etatane har i dag, er som regel
gode nok til at etatane kan følgje opp at verksemdene etterlever
regelverket. Det store fleirtalet av verksemdene respekterer og følgjer
både regelverket og pålegga frå etatane. Likevel finst det verksemder
som neglisjerer pålegg, eller som stadig tek opp att tidlegare lovbrot.
Konkrete erfaringar frå Arbeidstilsynet viser at enkelte bransjar
og enkeltverksemder er overrepresenterte på statistikken over brot
på arbeidsmiljøregelverket. I mange tilfelle kan det òg vere ein
samanheng mellom mykje bruk av utanlandsk arbeidskraft og hyppige
lovbrot. Arbeidstilsynet sine erfaringar viser at det er ein tendens
til at utanlandske arbeidstakarar er meir utsette for brot på arbeidsmiljø-
og sikkerheitsregelverket enn innanlandsk arbeidskraft.
For stadige likearta lovbrot i den same verksemda
kan lovbrotsgebyr vere eit meir effektivt sanksjonsmiddel enn pålegg,
tvangsmulkt, stansing eller melding til politiet. Ein rett for etatane
til å skrive ut lovbrotsgebyr vil såleis innebere at det er knytt
ein større økonomisk risiko for tilsynsobjekta til det å gjere seg
skuldig i brot på arbeidsmiljøregelverket enn det som er tilfellet
i dag. Slik sett kan lovbrotsgebyr vere eit effektivt sanksjonsmiddel
for å få bukt med gjengangartilfella.
Det finst eit udekt sanksjonsbehov, og departementet
vil sende på høyring forslag om å innføre lovbrotsgebyr som eit
reaksjonsmiddel for brot på arbeidsmiljøregelverket.
Handheving av allmenngjeringslova og arbeidsmiljølova
I kapittel 16.5 i medlinga blir det drøfta om
dei handhevingsmåtane Arbeidstilsynet og Petroleumstilsynet har
i dag når det gjeld alvorlege brot på arbeidsmiljølova og allmenngjeringslova,
er gode nok. God og effektiv handheving er viktig for å sikre at
allmenngjeringslova og arbeidsmiljølova blir etterlevde. Både allmenngjeringslova
og arbeidsmiljølova er straffesanksjonerte.
Enkelte har teke til orde for at ein bør vurdere
å sjå på fleire måtar å handheve dei meir alvorlege brota på arbeidsmiljøregelverket
på. Av forslag som er blitt trekte fram, kan nemnast inndraging av
overskot i verksemder som bryt arbeidsmiljøregelverket, og høve
til kollektivt søksmål for fagforeiningar. I tillegg har Riksadvokaten og
Økokrim peikt på at strafferammene i både allmenngjeringslova og
arbeidsmiljølova er blitt hengande etter utviklinga i andre miljølover
dei seinare åra, og dei meiner at arbeidsmiljølovgivinga ikkje bør
ha lågare strafferammer enn anna miljølovgiving.
Det skal ha konsekvensar å gjere seg skuldig
i brot på arbeidsmiljøregelverket, og det er viktig at det finst
gode system som sikrar dette. Kampen mot arbeidsmiljøkriminalitet
er viktig. Di større sjanse det er for at arbeidsmiljøkriminalitet
blir oppdaga, og får ein formålstenleg reaksjon, di større blir
også den avskrekkande effekten.
Departementet vil setje i gang ei brei og heilskapleg
utgreiing av handhevinga av alvorlege brot på arbeidsmiljøregelverket,
der mellom anna behovet for auka strafferammer skal vurderast.
Tiltak:
Departementet vil
sende på høyring eit forslag om å gi Arbeidstilsynet tilsynskompetanse
etter forskrift om lønns- og arbeidsvilkår i offentlige kontrakter
(ILO 94).
Arbeidstilsynet vil styrkje arbeidslivsrettleiinga overfor
innvandrarar.
Departementet vil sende på høyring eit
forslag om å innføre ein heimel for Arbeidstilsynet og Petroleumstilsynet
til å skrive ut lovbrotsgebyr for brot på arbeidsmiljøregelverket.
Departementet vil setje i gang ei brei
og heilskapleg utgreiing av handhevinga av alvorlege brot på arbeidsmiljøregelverket.
3.6	Systematisk dokumentasjon av status og utvikling
på arbeidsmiljø- og sikkerheits-området
3.6.1	Sammendrag
Her blir det mellom anna gjort greie for at
den noverande registreringa av arbeidsulykker, yrkessjukdommar og
arbeidsskadedødsfall er for fragmentert og gir ei mangelfull oversikt
over omfanget og utviklinga av arbeidsrelaterte ulykker, skadar
og sjukdom i Noreg.
Det er viktig at aktørane på arbeidsmiljøområdet har
oppdatert kunnskap og dokumentasjon over status og utviklinga på
området. Dette er avgjerande for at dei som har ansvar og oppgåver,
både i verksemdene og på nasjonalt nivå, skal kunne følgje opp ansvaret
sitt og oppgåvene sine. Manglande eller mangelfull statistikk og dokumentasjon
inneber ein fare for at risikoforhold og utviklingstrendar ikkje
blir fanga godt nok opp, og det gir eit for dårleg grunnlag for førebyggings-
og oppfølgingsarbeidet hos ulike aktørar og etatar.
Det er behov for å setje i verk fleire tiltak
for å forbetre registrering, statistikk og dokumentasjon knytt til
nøkkelinformasjon på arbeidshelse- og arbeidsmiljøområdet.
Tiltak:
Den nasjonale statistikken
over yrkesskadar og yrkessjukdommar skal forbetrast gjennom eit
utviklingsarbeid i regi av SSB, Arbeids- og velferdsdirektoratet,
Arbeidstilsynet og NOA som alt er sett i gang, og som også skal
følgje opp norske- forpliktingar etter ei EU-forordning.
Arbeidstilsynet skal etablere eit nytt
«Register for arbeidsulykker med alvorleg personskade».
Legar skal på lengre sikt kunne melde arbeidsrelatert
sjukdom til Arbeidstilsynet via ein elektronisk pasientjournal.
I regi av Helse- og omsorgsdepartementet
går det føre seg ei rekkje utviklingsarbeid som vil for-betre ulike
register og dokumentasjon som er viktig for arbeidsmiljø- og arbeidshelseområdet, mellom
anna modernisering og forbetringar av Dødsårsaksregisteret, Norsk
Pasientskaderegister og andre sentrale helseregister.
3.7	Forskingsbehov, utdanningstilbod og 
fagkompetanse
3.7.1	Sammendrag
Her vert drøfta det store kunnskaps- og forskingsbehovet
innanfor områda arbeidsforhold, arbeidsrett, arbeidsmiljø og sikkerheit.
Oppdatert kunnskap om forhold i norsk arbeidsliv
som er årsak til helseskade eller på annan måte påverkar deltakinga
i arbeidslivet, er nødvendig for at verksemdene og partane i arbeidslivet
skal kunne følgje opp ansvaret sitt på arbeidsmiljøområdet. For
å kunne førebyggje helseskadelege påverknader effektivt er det òg svært
viktig med kunnskap om kva for førebyggjande tiltak som verkar.
Kunnskap om risikoforhold, årsakssamanhengar, utbreiing og førebyggjande
tiltak er også avgjerande for styresmaktene si evne til gode reguleringar
og innretning av tilsynsverksemda.
Kunnskapsbehovet på arbeidshelse- og arbeidsmiljøområdet
er breitt og samansett, og det omfattar mellom anna teknologisk,
medisinsk, kjemisk, biologisk, juridisk og samfunnsvitskapleg forsking.
På grunn av høg endringstakt, dei svært ulike og samansette forholda
og komplekse, samverkande eksponeringsforhold og effektar i arbeidslivet,
er det spesielt utfordrande å utvikle kunnskap på området. Det er
behov for å adressere dei viktige kunnskapsbehova på arbeidshelse-
og arbeidsmiljøområdet, og departementet har derfor teke initiativ
til ei nærmare drøfting både med partane i arbeidslivet og med Noregs
forskingsråd.
Tiltak:
Departementet har
teke initiativ til ei nærmare drøfting med Forskingsrådet om korleis
arbeidsmiljø- og arbeidshelseforskinga betre kan sikrast innanfor
ramma av Noregs forskingsråd og departementet sine løyvingar til
Forskingsrådet. Det er allereie sett i gang eit arbeid med å revidere
mandatet og profilen for Sjukefraværsprogrammet, slik at dette programmet
også skal dekkje arbeidshelse- og arbeidsmiljøforsking.
Departementet tek sikte på å vidareføre
sine rammer til HMS-forsking i petroleumssektoren i regi av Forskingsrådet.
Det skal drøftast nærmare mellom departementet, OED og Forskingsrådet
korleis HMS-satsinga skal organiserast for å sikre ei god kopling
og integrering med petro-leumsforskinga elles.
Den faglege og økonomiske styrkinga av
utdanningskapasiteten ved dei arbeidsmedisinske avdelingane og STAMI
si koordinerande rolle på det arbeidsmedisinske feltet, som er sett
i verk i eit samarbeid mellom styresmaktene og hovudorganisasjonane,
har sikra dei uttalte behova for betre koordinering og styrking
av den arbeidsmedisinske kompetansen.
3.8	Sosial dumping
3.8.1	Sammendrag
Som det er peikt på i innleiinga i meldinga
og i det overordna drøftingskapitlet (kapittel 12 i medlinga) er
sosial dumping ei av hovudutfordringane i det norske arbeidslivet,
og fleire kapittel i meldinga behandlar sider ved denne problemstillinga.
Arbeidsinnvandring har vore eit positivt bidrag til
det norske arbeidslivet i ei tid då det i mange bransjar har vore
eit stort behov for arbeidskraft. Samtidig har det vist seg at utanlandske
arbeidstakarar i mange tilfelle får lønns- og arbeidsvilkår som
ikkje er akseptable samanlikna med det som er standarden elles i
norsk arbeidsliv.
Dette er uheldig, både fordi det inneber ei
forskjellsbehandling, og fordi ein risikerer at dårlege vilkår for
arbeidsinnvandrarar fører til negative konsekvensar også for norske
arbeidstakarar når dei opparbeidde rettane deira blir sette under
press. Samtidig risikerer ein at seriøse verksemder blir utkonkurrerte
fordi dei blir dyrare å bruke.
Det er siden 2005 arbeidd systematisk for å
hind-re sosial dumping og er sett i verk to handlingsplanar mot
sosial dumping, som har vore målretta – og dels bransjeretta – tiltaksplanar.
I tråd med desse planane er tilsyna styrka vesentleg, både økonomisk
og ved å gi dei fleire sanksjonsmiddel.
Andre viktige tiltak har vore innføring av id-kort i
byggje- og reinhaldsbransjen, regionale verneombod i hotell- og
restaurantbransjen og reinhaldsbransjen, solidaransvar for lønn
etter allmenngjeringsforskrifter, informasjons- og samsvarsplikt
for oppdragsgivarar, innsynsrett for tillitsvalde og etableringa
av eit servicesenter for arbeidsinnvandring. Kapitlet gir ei oversikt over
alle tiltaka som er sette i verk i tråd med handlingsplanane.
Arbeidet mot sosial dumping så langt har gitt nokre
viktige erfaringar, og dette arbeidet er eit sentralt element i
bransjesamarbeidet som er omtalt i kapittel 13 i meldinga. Der blir
det trekt vekslar på dei erfaringane som er gjorde i arbeidet mot
sosial dumping.
Når det gjeld allmenngjeringslova, blir det
her ikkje signalisert noka stor endring i ordninga slik ho har utvikla
seg dei seinare åra. Kapitlet drøftar nokre utfordringar med ordninga,
til dømes problemstillingar knytte til vilkåra for å gjere vedtak
om allmenngjering og forholdet til EØS-retten.
Eit potensielt viktig tiltak som blir vurdert,
er å gi tilsynsstyresmaktene ei meir formalisert rolle i kartlegginga
av om det er grunnlag for allmenngjering i ein bransje.
Arbeidsdepartementet har initiert ei evaluering av
dei to handlingsplanane mot sosial dumping. Evalueringa vil vere
klar i løpet av kort tid. Departementet vil gå igjennom evalueringa
saman med partane i arbeidslivet og vurdere eventuelle konsekvensar
for verkemiddelbruken på dette området.
Tiltak:
Det blir vurdert
å gi tilsynsorgana ei meir formalisert rolle i kartlegginga av om
det er grunnlag for allmenngjering av lønnsvilkåra i ein bransje.
3.9	Helse, miljø og sikkerheit i petroleums-verksemda
3.9.1	Sammendrag
Stortinget bad i 2001 om at det skulle leggjast fram
ei melding om HMS-tilstanden i petroleumssektoren kvart fjerde år.
Den førre meldinga blei lagd fram i april 2006. Denne nye meldinga
handlar om HMS-tilstanden i heile det norske arbeidslivet – også
storulykkesrisikoen i petroleumsverksemda, som er omtalt i kapittel 20.
Petroleumsverksemda er òg framheva for å synleggjere risikonivå,
HMS-tilstand og ansvarsplassering i ei verksemd som er svært viktig
for Noreg.
Ambisjonen er at norsk petroleumsverksemd skal
vere verdsleiande innanfor HMS. Kapittel 20 i meldinga gjer greie
for handtering av risiko i petroleumsverksemda. Sjølv om petroleumsverksemda
har eit relativt høgt ulykkespotensial, skjer det svært få arbeidsulykker
og dødsfall, og få alvorlege og akutte utslepp. Det har likevel vore
ein auke av tilløp til hendingar innanfor området for gasslekkasjar
og brønnkontrollhendingar som kunne ha ført til ei storulykke. Dette
 krev ekstra merksemd. Petroleumstilsynet har teke kontakt med næringa
og har bede om at det blir utarbeidd ein strategi for å snu den
negative utviklinga.
Petroleumsverksemda er generelt prega av systematisk
innsats for å forbetre risikonivået. Eit velfungerande partssamarbeid,
ansvarlege aktørar og eit sterkt tilsyn er avgjerande suksessfaktorar
for dagens situasjon. Utfordringa ligg i å kunne vidareføre den
positive utviklinga som har skjedd dei siste ti åra, og motivere
til ytterlegare forbetringar. Ei særleg utfordring ligg i å snu
den negative utviklinga når det gjeld gasslekkasjar og brønnhendingar
dei siste par åra, og igjen sørgje for ein redusert hendingsfrekvens
på desse viktige områda. Næringa har sjølv ansvaret for at sikkerheita
heile tida er god, og har lansert fleire handlingspunkt for å oppnå forbetringar
på dei områda der det har vore ei negativ utvikling. Frå styresmaktene
si side er det viktig å følgje opp at forbet-ringsaktivitetane i
næringa er effektive, og at dei blir tekne i bruk av heile næringa.
Ei positiv utvikling i risikobiletet føreset
at det ligg ei stadig oppfordring til alle partar om å halde fram
med det gode arbeidet og leite etter område der ein kan oppnå forbetringar.
I tillegg er det svært viktig at rollefordelinga der partane samarbeider
med Petroleumstilsynet, ikkje blir undergraven.
Det blir òg gjort greie for den alvorlege hendinga i
Mexicogolfen i april 2010 og oppfølginga nasjonalt og internasjonalt,
med vekt på Petroleumstilsynet og Arbeidsdepartementet sine roller
og vurderingar.
For å auke kunnskapen om korleis tilsynsstyresmaktene
si oppfølging er tilpassa dei utfordringane vi står overfor i dag
og i framtida, meiner departementet at det er behov for ein brei
gjennomgang og ei grundig vurdering av dagens HMS-regime på petroleumsområdet.
Ein slik gjennomgang bør særleg rettast mot strategiar, prioriteringar,
verkemiddelbruk og HMS-regelverk.
Tiltak:
Departementet vil
på denne bakgrunn setje i gang eit arbeid med sikte på ein brei
gjennomgang av tilsynsstrategi og HMS-regelverk i petroleumsverksemda.
3.10	Enkelte særlege arbeidsmiljøutfordringar i arbeidslivet
3.10.1	Sammendrag
Kapitlet tek for seg særlege HMS-utfordringar
i arbeidslivet som kan få alvorlege helsemessige konsekvensar for
dei som blir ramma. Tema er valde ut frå at det på desse områda
er eit stort potensial for forbetring eller ny kunnskap. Det blir gjort
greie for status når det gjeld arbeidsskadedødsfall og alvorlege
skadar i arbeidslivet, kjemisk arbeidsmiljø, skadar og plager på
grunn av støy og helserisiko ved nattarbeid.
Arbeidsskadedødsfall og alvorlege skadar i arbeidslivet
